<?xml version="1.0" encoding="UTF-8"?>
<offres xmlns:xsi="http://www.w3.org/2001/XMLSchema-instance" xsi:noNamespaceSchemaLocation="voyage.xsd">
    <offre type="classique">
        <langues>
            <langue>Anglais</langue>
        </langues>
        <destination>
            <ville>Londres</ville>
            <pays>Royaume-Uni</pays>
        </destination>
        <activites_sportives>Football</activites_sportives>
        <activites_culturelles>Visite du British Museum</activites_culturelles>
        <dates>
            <debut>2023-07-15</debut>
            <fin>2023-09-15</fin>
        </dates>
        <client type="famille">
            <nom>Dupont</nom>
            <prenom>Paul</prenom>
            <age>46</age>
        </client>
    </offre>
    <offre type="classique">
        <langues>
            <langue>Anglais</langue>
        </langues>
        <destination>
            <ville>Londres</ville>
            <pays>Royaume-Uni</pays>
        </destination>
        <activites_sportives>Football</activites_sportives>
        <activites_culturelles>Visite du British Museum</activites_culturelles>
        <dates>
            <debut>2022-02-15</debut>
            <fin>2022-03-15</fin>
        </dates>
        <client type="famille">
            <nom>Dupont</nom>
            <prenom>Paul</prenom>
            <age>46</age>
        </client>
    </offre>
    <offre type="classique">
        <langues>
            <langue>Espagnol</langue>
        </langues>
        <destination>
            <ville>Barcelone</ville>
            <pays>Espagne</pays>
        </destination>
        <activites_sportives>Football</activites_sportives>
        <activites_culturelles>Visite du British Museum</activites_culturelles>
        <dates>
            <debut>2023-08-30</debut>
            <fin>2023-10-30</fin>
        </dates>
        <client type="famille">
            <nom>Dupont</nom>
            <prenom>Paul</prenom>
            <age>46</age>
        </client>
    </offre>
    <offre type="classique">
        <langues>
            <langue>Allemand</langue>
            <langue>Francais</langue>
        </langues>
        <destination>
            <ville>Berlin</ville>
            <pays>Allemagne</pays>
        </destination>
        <activites_sportives>Volley-ball</activites_sportives>
        <activites_culturelles>Visite du mur de Berlin</activites_culturelles>
        <dates>
            <debut>2023-01-24</debut>
            <fin>2023-02-10</fin>
        </dates>
            <client type="adulte">
                <nom>Dubois</nom>
                <prenom>Marie</prenom>
                <age>28</age>
            </client>
    </offre>
    <offre type="scolaire">
        <voyage_scolaire>
            <matieres>
                <matiere id='m0'>
                    <nom>Histoire</nom>
                    <evaluation>true</evaluation>
                </matiere>
                <matiere id='m1'>
                    <nom>Langues étrangères</nom>
                    <evaluation>true</evaluation>
                </matiere>
            </matieres>
            <enseignants>
                <enseignant>
                    <nom>Girard</nom>
                    <prenom>Lucie</prenom>
                    <age>23</age>
                    <matiere-enseignee ref-matiere="m0"/>
                </enseignant>
                <enseignant>
                    <nom>Bichon</nom>
                    <prenom>Thomas</prenom>
                    <age>45</age>
                    <matiere-enseignee ref-matiere="m1"/>
                </enseignant>
            </enseignants>
            <accompagnateurs>
                <accompagnateur>
                    <nom>Clerc</nom>
                    <prenom>Clara</prenom>
                    <age>18</age>
                </accompagnateur>
                <accompagnateur>
                    <nom>Mitou</nom>
                    <prenom>Ludivine</prenom>
                    <age>35</age>
                </accompagnateur>
            </accompagnateurs>
            <nombre_eleves>25</nombre_eleves>
        </voyage_scolaire>
        <langues>
            <langue>Espagnol</langue>
            <langue>Catalan</langue>
        </langues>
        <destination>
            <ville>Madrid</ville>
            <pays>Espagne</pays>
        </destination>
        <activites_sportives>Football</activites_sportives>
        <activites_culturelles>Visite du musée du Prado</activites_culturelles>
        <dates>
            <debut>2023-06-08</debut>
            <fin>2023-09-08</fin>
        </dates>
        <client type="enfant">
            <nom>Moreau</nom>
            <prenom>Jules</prenom>
            <age>14</age>
        </client>
    </offre>
    <offre type="accueil">
        <immersion_famille_accueil>
            <famille_accueil>
                <nom>Leclerc</nom>
                <nombre_de_place>2</nombre_de_place>
                <nationalite>française</nationalite>
            </famille_accueil>
        </immersion_famille_accueil>
        <langues>
            <langue>Francais</langue>
            <langue>Anglais</langue>
        </langues>
        <destination>
            <ville>Paris</ville>
            <pays>France</pays>
        </destination>
        <activites_culturelles>Visite de la Tour Eiffel, Promenade en bateau-mouche sur la Seine</activites_culturelles>
        <dates>
            <debut>2023-12-07</debut>
            <fin>2023-12-28</fin>
        </dates>
        <client type="famille">
            <nom>Dupont</nom>
            <prenom>Julie</prenom>
            <age>35</age>
        </client>
    </offre>
    <offre type="colonie">
        <colonie_de_vacances>
            <moniteurs>
                <nom>Leblanc</nom>
                <prenom>Antoine</prenom>
                <age>26</age>
            </moniteurs>
            <moniteurs>
                <nom>Martin</nom>
                <prenom>Lucas</prenom>
                <age>32</age>
            </moniteurs>
        </colonie_de_vacances>
        <langues>
            <langue>Anglais</langue>
            <langue>Espagnol</langue>
        </langues>
        <destination>
            <ville>Barcelone</ville>
            <pays>Espagne</pays>
        </destination>
        <activites_sportives>Surf, Kayak, Beach-volley</activites_sportives>
        <dates>
            <debut>2023-05-30</debut>
            <fin>2023-10-24</fin>
        </dates>
        <client type="enfant">
            <nom>Smith</nom>
            <prenom>Lucie</prenom>
            <age>11</age>
        </client>
    </offre>
</offres>
